{
  "schema_version": "1.0",
  "benchmark_id": "fnd03-final-synthesis-independent-review",
  "run_id": "fnd03-final-91e3fca-20260809",
  "target": {
    "repository": "kooiei-in4a/minimal-bank-system",
    "issue": 41,
    "pr": 104,
    "base_sha": "7946cc55e49c0c6e21ad7b86c20a8435b4976269",
    "head_sha": "91e3fca181558cd1523390347f4f2f80d6014d26",
    "ci_target_sha": "91e3fca181558cd1523390347f4f2f80d6014d26"
  },
  "reviewer": {
    "slug": "grok-4.5-cursor",
    "model": "Grok 4.5",
    "harness": "Cursor",
    "effort": "high fast"
  },
  "attempt": 1,
  "outcome": "completed",
  "target_verification": {
    "repository": true,
    "base_sha": true,
    "head_sha": true,
    "pr": true,
    "ci_sha": true
  },
  "verdict": "approve",
  "counts": {
    "blocker": 0,
    "major": 0,
    "minor": 0,
    "nit": 0
  },
  "findings": [],
  "ci_verified": true,
  "local_verification": {
    "performed": true,
    "summary": "Detached worktree at 91e3fca: restore/build clean; Category!=PostgreSqlIntegration 30/30; Category=PostgreSqlIntegration 7/7; full suite Unit 3 + Integration 34. Primary CI 31277771209: Restore/Build/non-PG/real-PG all success (non-PG 3+27, PG 7, 0 skipped)."
  },
  "recorded_at": "2026-08-08T21:27:06.7391426Z",
  "notes": "Independent review of fixed Head only; did not read other reviewer results, PR review threads, Gold reviews, or forbidden FND-02/FND-03 benchmark evaluation docs. Workspace tip differed from target and was not used as authority. Untested container DisposeAsync failure injection noted but not filed as a finding because exceptions are not swallowed and the handle is retained."
}
