{ "schema_version": "1.0", "benchmark_id": "fnd03-final-synthesis-independent-review", "run_id": "fnd03-final-91e3fca-20260809", "target": { "repository": "kooiei-in4a/minimal-bank-system", "issue": 41, "pr": 104, "base_sha": "7946cc55e49c0c6e21ad7b86c20a8435b4976269", "head_sha": "91e3fca181558cd1523390347f4f2f80d6014d26", "ci_target_sha": "91e3fca181558cd1523390347f4f2f80d6014d26" }, "reviewer": { "slug": "mimo-v2.5-opencode", "model": "MiMo-V2.5", "harness": "Open Code", "effort": null }, "attempt": 1, "outcome": "completed", "target_verification": { "repository": true, "base_sha": true, "head_sha": true, "pr": true, "ci_sha": true }, "verdict": "approve", "counts": { "blocker": 0, "major": 0, "minor": 0, "nit": 0 }, "findings": [], "ci_verified": true, "local_verification": { "performed": false, "summary": "Head SHA 91e3fca not checked out locally; local HEAD is at base 7946cc5. Local verification could not be performed without modifying repository state." }, "recorded_at": null, "notes": "CI run da2f915 is a merge commit (PR head into base), standard for pull_request events. ConsoleCapture locking fix is a direct consequence of enabling assembly parallelization. Cleanup failure injection uses pre-cancelled CancellationToken. No exception swallowing found in any cleanup path. cleanupGate semaphore always released in finally." }
