{
  "schema_version": "1.0",
  "benchmark_id": "fnd03-final-synthesis-independent-review",
  "run_id": "fnd03-final-91e3fca-20260809",
  "target": {
    "repository": "kooiei-in4a/minimal-bank-system",
    "issue": 41,
    "pr": 104,
    "base_sha": "7946cc55e49c0c6e21ad7b86c20a8435b4976269",
    "head_sha": "91e3fca181558cd1523390347f4f2f80d6014d26",
    "ci_target_sha": "91e3fca181558cd1523390347f4f2f80d6014d26"
  },
  "reviewer": {
    "slug": "composer-2.5-cursor",
    "model": "Composer 2.5",
    "harness": "Cursor",
    "effort": null
  },
  "attempt": 1,
  "outcome": "completed",
  "target_verification": {
    "repository": true,
    "base_sha": true,
    "head_sha": true,
    "pr": true,
    "ci_sha": true
  },
  "verdict": "approve",
  "counts": {
    "blocker": 0,
    "major": 0,
    "minor": 0,
    "nit": 0
  },
  "findings": [],
  "ci_verified": true,
  "local_verification": {
    "performed": true,
    "summary": "dotnet restore/build succeeded; non-PostgreSQL tests 30 passed; PostgreSQL integration tests 7 passed with real Docker container, digest/version runtime assertions, and cleanup failure injection verified locally"
  },
  "recorded_at": "2026-08-09T07:05:00+09:00",
  "notes": "Reviewed only the 3 PostgreSQL files tracked at HEAD 91e3fca; ignored untracked benchmark candidate artifacts in workspace. Did not reference other reviewers, PR reviews, or benchmark evaluation documents."
}
