{
"schema_version": "1.0",
"benchmark_id": "fnd03-final-synthesis-independent-review",
"run_id": "fnd03-final-91e3fca-20260809",
"target": {
"repository": "kooiei-in4a/minimal-bank-system",
"issue": 41,
"pr": 104,
"base_sha": "7946cc55e49c0c6e21ad7b86c20a8435b4976269",
"head_sha": "91e3fca181558cd1523390347f4f2f80d6014d26",
"ci_target_sha": "91e3fca181558cd1523390347f4f2f80d6014d26"
},
"reviewer": {
"slug": "chatgpt-gpt-5.5-browser",
"model": "ChatGPT GPT 5.5",
"harness": "Browser",
"effort": "xhigh"
},
"attempt": 1,
"outcome": "completed",
"target_verification": {
"repository": true,
"base_sha": true,
"head_sha": true,
"pr": true,
"ci_sha": true
},
"verdict": "approve",
"counts": {
"blocker": 0,
"major": 0,
"minor": 0,
"nit": 0
},
"findings": [],
"ci_verified": true,
"local_verification": {
"performed": false,
"summary": "GitHub PR metadata, base/head comparison, changed-file set, source files, workflow definition, workflow run 31277771209, job 93154058679, and job logs were independently checked through the GitHub connector. Local build/test/probe was not performed because the sandbox had no dotnet or docker, and direct GitHub network access from the sandbox failed DNS resolution."
},
"recorded_at": null,
"notes": "PR discovery accidentally returned PR #105 and exposed benchmark ranking / score information; it was not used as review evidence. PR #104 body was treated as secondary context only. Existing PR review submissions, inline review threads, Gold / Reference Review, normalized findings, and benchmark aggregate artifacts were not intentionally opened. Deterministic injection of a Testcontainers-internal container DisposeAsync failure was not locally executed; the code path was reviewed and no blocking issue was found."
}
